[
  {
    "schema_name": "agent.identity.event",
    "schema_version": "2.0",
    "event_id": "evt:sample-request",
    "event_type": "request.received",
    "tenant_id": "tenant:northstar",
    "producer": "edge-gateway",
    "sequence": 1,
    "occurred_at": 1800000000,
    "trace_id": "4bf92f3577b34da6a3ce929d0e0e4736",
    "span_id": "00f067aa0ba902b7",
    "parent_span_id": null,
    "actor_id": "user:1042",
    "actor_type": "human",
    "subject_id": "user:1042",
    "workload_id": "spiffe://northstar.example/prod/claims-agent",
    "expected_workload_id": "spiffe://northstar.example/prod/claims-agent",
    "action": "claims.read",
    "resource": "claim:synthetic-42",
    "outcome": "success",
    "decision": null,
    "authorization_request_id": null,
    "policy_version": null,
    "delegation_id": null,
    "parent_scope": [],
    "delegated_scope": [],
    "credential_fingerprint": null,
    "causes_event_id": null,
    "attributes": {}
  },
  {
    "schema_name": "agent.identity.event",
    "schema_version": "2.0",
    "event_id": "evt:sample-agent",
    "event_type": "agent.invoke",
    "tenant_id": "tenant:northstar",
    "producer": "agent-runtime",
    "sequence": 1,
    "occurred_at": 1800000001,
    "trace_id": "4bf92f3577b34da6a3ce929d0e0e4736",
    "span_id": "b7ad6b7169203331",
    "parent_span_id": "00f067aa0ba902b7",
    "actor_id": "agent:claims",
    "actor_type": "agent",
    "subject_id": "user:1042",
    "workload_id": "spiffe://northstar.example/prod/claims-agent",
    "expected_workload_id": "spiffe://northstar.example/prod/claims-agent",
    "action": "claims.read",
    "resource": "claim:synthetic-42",
    "outcome": "success",
    "decision": null,
    "authorization_request_id": null,
    "policy_version": null,
    "delegation_id": null,
    "parent_scope": [],
    "delegated_scope": [],
    "credential_fingerprint": null,
    "causes_event_id": null,
    "attributes": {}
  },
  {
    "schema_name": "agent.identity.event",
    "schema_version": "2.0",
    "event_id": "evt:sample-delegation",
    "event_type": "delegation.issued",
    "tenant_id": "tenant:northstar",
    "producer": "governance",
    "sequence": 1,
    "occurred_at": 1800000002,
    "trace_id": "4bf92f3577b34da6a3ce929d0e0e4736",
    "span_id": "a4f0d1c2b3e4f501",
    "parent_span_id": "b7ad6b7169203331",
    "actor_id": "agent:claims",
    "actor_type": "agent",
    "subject_id": "user:1042",
    "workload_id": "spiffe://northstar.example/prod/claims-agent",
    "expected_workload_id": "spiffe://northstar.example/prod/claims-agent",
    "action": "claims.read",
    "resource": "claim:synthetic-42",
    "outcome": "success",
    "decision": null,
    "authorization_request_id": null,
    "policy_version": null,
    "delegation_id": "delegation:42",
    "parent_scope": [
      "claims.read"
    ],
    "delegated_scope": [
      "claims.read"
    ],
    "credential_fingerprint": null,
    "causes_event_id": null,
    "attributes": {}
  },
  {
    "schema_name": "agent.identity.event",
    "schema_version": "2.0",
    "event_id": "evt:sample-token",
    "event_type": "credential.exchanged",
    "tenant_id": "tenant:northstar",
    "producer": "token-service",
    "sequence": 1,
    "occurred_at": 1800000003,
    "trace_id": "4bf92f3577b34da6a3ce929d0e0e4736",
    "span_id": "a4f0d1c2b3e4f502",
    "parent_span_id": "b7ad6b7169203331",
    "actor_id": "agent:claims",
    "actor_type": "agent",
    "subject_id": "user:1042",
    "workload_id": "spiffe://northstar.example/prod/claims-agent",
    "expected_workload_id": "spiffe://northstar.example/prod/claims-agent",
    "action": "claims.read",
    "resource": "claim:synthetic-42",
    "outcome": "success",
    "decision": null,
    "authorization_request_id": null,
    "policy_version": null,
    "delegation_id": null,
    "parent_scope": [],
    "delegated_scope": [],
    "credential_fingerprint": "hmac:eb5b30bb6f391e3fc7375694496fb12907c27622308a154b637aa67ba46b8f54",
    "causes_event_id": null,
    "attributes": {}
  },
  {
    "schema_name": "agent.identity.event",
    "schema_version": "2.0",
    "event_id": "evt:sample-decision",
    "event_type": "authorization.decision",
    "tenant_id": "tenant:northstar",
    "producer": "policy-engine",
    "sequence": 1,
    "occurred_at": 1800000004,
    "trace_id": "4bf92f3577b34da6a3ce929d0e0e4736",
    "span_id": "a4f0d1c2b3e4f503",
    "parent_span_id": "b7ad6b7169203331",
    "actor_id": "agent:claims",
    "actor_type": "agent",
    "subject_id": "user:1042",
    "workload_id": "spiffe://northstar.example/prod/claims-agent",
    "expected_workload_id": "spiffe://northstar.example/prod/claims-agent",
    "action": "claims.read",
    "resource": "claim:synthetic-42",
    "outcome": "success",
    "decision": "permit",
    "authorization_request_id": "authz:42",
    "policy_version": "claims-access-17",
    "delegation_id": null,
    "parent_scope": [],
    "delegated_scope": [],
    "credential_fingerprint": null,
    "causes_event_id": null,
    "attributes": {}
  },
  {
    "schema_name": "agent.identity.event",
    "schema_version": "2.0",
    "event_id": "evt:sample-enforce",
    "event_type": "authorization.enforced",
    "tenant_id": "tenant:northstar",
    "producer": "policy-enforcer",
    "sequence": 1,
    "occurred_at": 1800000005,
    "trace_id": "4bf92f3577b34da6a3ce929d0e0e4736",
    "span_id": "a4f0d1c2b3e4f504",
    "parent_span_id": "b7ad6b7169203331",
    "actor_id": "agent:claims",
    "actor_type": "agent",
    "subject_id": "user:1042",
    "workload_id": "spiffe://northstar.example/prod/claims-agent",
    "expected_workload_id": "spiffe://northstar.example/prod/claims-agent",
    "action": "claims.read",
    "resource": "claim:synthetic-42",
    "outcome": "success",
    "decision": null,
    "authorization_request_id": "authz:42",
    "policy_version": "claims-access-17",
    "delegation_id": null,
    "parent_scope": [],
    "delegated_scope": [],
    "credential_fingerprint": null,
    "causes_event_id": "evt:sample-decision",
    "attributes": {}
  },
  {
    "schema_name": "agent.identity.event",
    "schema_version": "2.0",
    "event_id": "evt:sample-tool",
    "event_type": "tool.execute",
    "tenant_id": "tenant:northstar",
    "producer": "mcp-gateway",
    "sequence": 1,
    "occurred_at": 1800000006,
    "trace_id": "4bf92f3577b34da6a3ce929d0e0e4736",
    "span_id": "a4f0d1c2b3e4f505",
    "parent_span_id": "b7ad6b7169203331",
    "actor_id": "agent:claims",
    "actor_type": "agent",
    "subject_id": "user:1042",
    "workload_id": "spiffe://northstar.example/prod/claims-agent",
    "expected_workload_id": "spiffe://northstar.example/prod/claims-agent",
    "action": "claims.read",
    "resource": "claim:synthetic-42",
    "outcome": "success",
    "decision": null,
    "authorization_request_id": null,
    "policy_version": null,
    "delegation_id": null,
    "parent_scope": [],
    "delegated_scope": [],
    "credential_fingerprint": null,
    "causes_event_id": null,
    "attributes": {}
  },
  {
    "schema_name": "agent.identity.event",
    "schema_version": "2.0",
    "event_id": "evt:sample-api",
    "event_type": "api.access",
    "tenant_id": "tenant:northstar",
    "producer": "claims-api",
    "sequence": 1,
    "occurred_at": 1800000007,
    "trace_id": "4bf92f3577b34da6a3ce929d0e0e4736",
    "span_id": "a4f0d1c2b3e4f506",
    "parent_span_id": "b7ad6b7169203331",
    "actor_id": "agent:claims",
    "actor_type": "agent",
    "subject_id": "user:1042",
    "workload_id": "spiffe://northstar.example/prod/claims-agent",
    "expected_workload_id": "spiffe://northstar.example/prod/claims-agent",
    "action": "claims.read",
    "resource": "claim:synthetic-42",
    "outcome": "success",
    "decision": null,
    "authorization_request_id": null,
    "policy_version": null,
    "delegation_id": null,
    "parent_scope": [],
    "delegated_scope": [],
    "credential_fingerprint": null,
    "causes_event_id": null,
    "attributes": {}
  }
]
